Book Title, Book Rating
The 7 Habits of Highly Effective People: Powerful Lessons in Personal Change,4.07 avg rating — 382,151 ratings
How to Win Friends and Influence People,4.16 avg rating — 392,392 ratings
The Alchemist,3.84 avg rating — 1,634,096 ratings
Oh, The Places You'll Go!,4.35 avg rating — 280,713 ratings
The Reframe: Reframe Relationships,3.97 avg rating — 156 ratings
Think and Grow Rich,4.17 avg rating — 139,293 ratings
The Power of Now: A Guide to Spiritual Enlightenment,4.12 avg rating — 139,683 ratings
Getting Things Done: The Art of Stress-Free Productivity,3.98 avg rating — 98,066 ratings
The Four Agreements: A Practical Guide to Personal Freedom,4.14 avg rating — 134,121 ratings
The Art of Happiness,4.16 avg rating — 74,970 ratings
Tuesdays with Morrie: An Old Man, a Young Man, and Life's Greatest Lesson,4.08 avg rating — 655,535 ratings
The Road Less Traveled: A New Psychology of Love, Traditional Values and Spiritual Growth,4.04 avg rating — 73,339 ratings
The Secret (The Secret, #1),3.65 avg rating — 281,349 ratings
As a Man Thinketh,4.29 avg rating — 44,594 ratings
Who Moved My Cheese?,3.77 avg rating — 292,982 ratings
The Five Love Languages: How to Express Heartfelt Commitment to Your Mate,4.23 avg rating — 218,239 ratings
Man's Search for Meaning,4.35 avg rating — 249,220 ratings
Eat, Pray, Love,3.53 avg rating — 1,301,928 ratings
The Diary of a Young Girl,4.12 avg rating — 2,276,170 ratings
Wherever You Go, There You Are: Mindfulness Meditation in Everyday Life,4.12 avg rating — 29,440 ratings
Emotional Intelligence 2.0,3.83 avg rating — 61,396 ratings
Don't Sweat the Small Stuff ... and it's all small stuff: Simple Ways to Keep the Little Things from Taking Over Your Life,3.96 avg rating — 72,080 ratings
Chicken Soup for the Soul,3.95 avg rating — 32,694 ratings
The Last Lecture,4.26 avg rating — 268,129 ratings
The Purpose Driven Life: What on Earth Am I Here for?,3.91 avg rating — 197,504 ratings
Change Your Thoughts - Change Your Life: Living the Wisdom of the Tao,4.26 avg rating — 14,938 ratings
The Power of Intention: Learning to Co-create Your World Your Way,4.19 avg rating — 25,188 ratings
Change Your Brain, Change Your Life: The Breakthrough Program for Conquering Anxiety, Depression, Obsessiveness, Anger, and Impulsiveness,3.97 avg rating — 7,853 ratings
First Things First,4.08 avg rating — 30,725 ratings
Psycho-Cybernetics, A New Way to Get More Living Out of Life,4.22 avg rating — 12,823 ratings
The Story of My Life,4.07 avg rating — 117,026 ratings
The Tipping Point: How Little Things Can Make a Big Difference,3.94 avg rating — 570,823 ratings
A New Earth: Awakening to Your Life's Purpose,4.05 avg rating — 127,228 ratings
The Success Principles: How to Get from Where You Are to Where You Want to Be,4.27 avg rating — 24,416 ratings
The Tao of Pooh,4.01 avg rating — 85,456 ratings
The Shack,3.75 avg rating — 468,517 ratings
Way of the Peaceful Warrior: A Book That Changes Lives,4.13 avg rating — 40,043 ratings
The Power of Positive Thinking,4.11 avg rating — 64,109 ratings
Daring Greatly: How the Courage to Be Vulnerable Transforms the Way We Live, Love, Parent, and Lead,4.25 avg rating — 72,909 ratings
The Dalai Lama's Little Book Of Wisdom,4.23 avg rating — 1,994 ratings
On Writing: A Memoir of the Craft,4.32 avg rating — 176,237 ratings
Now, Discover Your Strengths: How to Develop Your Talents and Those of the People You Manage,3.96 avg rating — 21,494 ratings
The Prophet,4.23 avg rating — 182,032 ratings
Eat Move Sleep: How Small Choices Lead to Big Changes,3.55 avg rating — 4,572 ratings
Mastery,4.28 avg rating — 18,257 ratings
Excuses Begone!: How to Change Lifelong, Self-Defeating Thinking Habits,4.15 avg rating — 6,754 ratings
The Happiness Project: Or Why I Spent a Year Trying to Sing in the Morning, Clean My Closets, Fight Right, Read Aristotle, and Generally Have More Fun,3.59 avg rating — 116,191 ratings
How to Stop Worrying and Start Living,4.10 avg rating — 60,901 ratings
The Forever Fight: On Drugs, Alcohol and the Cycle of Addiction,4.94 avg rating — 78 ratings
The Monk Who Sold His Ferrari: A Fable About Fulfilling Your Dreams and Reaching Your Destiny,3.80 avg rating — 77,711 ratings
Feel the Fear and Do It Anyway,4.02 avg rating — 22,498 ratings
The Art of Success: What No One Ever Taught You (But You Still Need to Know),4.12 avg rating — 106 ratings
The One Thing: The Surprisingly Simple Truth Behind Extraordinary Results,4.16 avg rating — 25,194 ratings
The Republic,3.92 avg rating — 136,618 ratings
The Allegory of the Cave,4.31 avg rating — 2,341 ratings
Maximum Achievement: Strategies and Skills that Will Unlock Your Hidden Powers to Succeed,4.26 avg rating — 3,089 ratings
Steve Jobs,4.11 avg rating — 728,951 ratings
Committed: A Skeptic Makes Peace with Marriage,3.40 avg rating — 43,950 ratings
Have a Little Faith: a True Story,4.17 avg rating — 67,650 ratings
The Prayer of Jabez: Breaking Through to the Blessed Life,3.93 avg rating — 63,662 ratings
You Are a Badass: How to Stop Doubting Your Greatness and Start Living an Awesome Life,really liked it
4.00 avg rating — 70,066 ratings
Cosmic Ordering Guide,3.66 avg rating — 155 ratings
Poor Richard's Almanack,4.08 avg rating — 1,409 ratings
Flow: The Psychology of Optimal Experience,4.10 avg rating — 38,700 ratings
Rich Dad, Poor Dad,really liked it
4.00 avg rating — 231,264 ratings
The Greatest Salesman in the World,4.20 avg rating — 43,409 ratings
The Compound Effect: Jumpstart Your Income, Your Life, Your Success,4.38 avg rating — 14,645 ratings
Diary of a Freedom Writer: The Experience,4.24 avg rating — 152 ratings
The New Psycho-Cybernetics: The Original Science of Self-Improvement and Success That Has Changed the Lives of 30 Million People,4.30 avg rating — 1,958 ratings
Think, Trade, and Grow Rich!: A Powerful Beginner's Guide to Building Passive Income Through Momentum Swing Trading and Stock Market Investing,4.75 avg rating — 16 ratings
Battlefield of the Mind: Winning the Battle in Your Mind,4.34 avg rating — 49,721 ratings
Success and Happiness: Quotes to Motivate Inspire & Live by,3.83 avg rating — 265 ratings
If You Want You Can Fly: An Inspirational and Motivational Book, Coaching Single Moms & Dads in their Quest for Love, Happiness and Fulfilling Relationships,4.60 avg rating — 15 ratings
Massive Action Equal Massive Results: Learn the Critical Mental Framework to Focus Your Energy, Reach Your Goals Quicker and Live an Insanely Awesome Life,4.28 avg rating — 47 ratings
Slim And Healthy You (Edible Excellence, #1),3.69 avg rating — 13 ratings
Drive: The Surprising Truth About What Motivates Us,3.94 avg rating — 72,522 ratings
Outliers: The Story of Success,4.12 avg rating — 409,037 ratings
Thinking, Fast and Slow,4.12 avg rating — 192,007 ratings
Stress Pandemic: The Lifestyle Solution: 9 Natural Steps to Survive, Master Stress and Live Well,3.66 avg rating — 95 ratings
The Truth of All that Is: The Angel book to Enlightenment and Personal Transformation,4.39 avg rating — 69 ratings
The Extremely Successful Salesman's Club,4.06 avg rating — 100 ratings
The Life-Changing Magic of Tidying Up: The Japanese Art of Decluttering and Organizing,3.79 avg rating — 175,938 ratings
Autobiography of a Yogi,4.22 avg rating — 36,000 ratings
Digging Deep: Unearthing Your Creative Roots Through Gardening,3.93 avg rating — 84 ratings
Defeating Your Self-Bully: A guide to stop beating yourself up and start building confidence for a life you deserve,4.29 avg rating — 14 ratings
The Spiritual Secrets Of Happiness Health And Success: A Powerful And Practical Guide For Manifesting The Life You Truly Desire,3.79 avg rating — 214 ratings
For One More Day,4.09 avg rating — 112,663 ratings
The Freedom Writers Diary,4.10 avg rating — 13,046 ratings
The Wonderful Spirit Filled Life,4.42 avg rating — 415 ratings
Loving Ordinary Life,4.42 avg rating — 79 ratings
Christian Warrior Women: A Guide to Taking Back Your Faith, Family & Future (Christian Warrior Women Series Book 1),4.95 avg rating — 21 ratings
Activities: Part 1 of "Romantic Activities and Surprises: 800 Dating Ideas - An Illustrated Guide for Men" (Win the Heart of a Woman of Your Dreams, #4),4.67 avg rating — 12 ratings
He's Just Not That Into You: The No-Excuses Truth to Understanding Guys,3.66 avg rating — 58,525 ratings
Daily Bible, with Devotional Insights to Guide You Through God's Word: NIV,4.69 avg rating — 910 ratings
Daily Writing Resilience: 365 Meditations & Inspirations for Writers,4.47 avg rating — 34 ratings
Flowerevolution: Blooming into Your Full Potential with the Magic of Flowers,4.49 avg rating — 47 ratings
Win the Heart of A Woman of Your Dreams,4.45 avg rating — 11 ratings
5 Essential Dimensions: How to Balance Your Life for Health, Success and Content,4.35 avg rating — 20 ratings
Achieve Anything in Just One Year: Be Inspired Daily to Live Your Dreams and Accomplish Your Goals,3.56 avg rating — 393 ratings
SWAP, The Best Way to Make Your Dreams Come True,4.33 avg rating — 6 ratings
Awaken the Giant Within: How to Take Immediate Control of Your Mental, Emotional, Physical and Financial Destiny!,4.13 avg rating — 44,428 ratings
What to Expect When You're Expecting,3.76 avg rating — 42,467 ratings
A Manager's Guide to Unleashing the Intrapreneur,4.45 avg rating — 11 ratings
Leadership: Past, Present & Future,4.20 avg rating — 40 ratings
Spartan Up!: A Take-No-Prisoners Guide to Overcoming Obstacles and Achieving Peak Performance in Life,3.93 avg rating — 1,454 ratings
Corners: Voices on Change,4.44 avg rating — 9 ratings
The 4-Hour Workweek,3.86 avg rating — 108,461 ratings
On the Other Hand: The Little Anthology of Big Questions,4.51 avg rating — 69 ratings
Make It Happen, A Healthy, Competitive Approach to Achieving Personal Success (3 Off the Tee, #2),4.19 avg rating — 80 ratings
Influence: The Psychology of Persuasion,4.18 avg rating — 65,942 ratings
The Jetstream of Success (Intellectual Maverick, #1),3.49 avg rating — 131 ratings
A-Ma Alchemy of Love,4.50 avg rating — 28 ratings
You Can Heal Your Life,4.15 avg rating — 54,388 ratings
Tree of Life (Alchemy of Love Mindfulness Training, #9),4.76 avg rating — 17 ratings
The Magic of Thinking Big,4.21 avg rating — 50,168 ratings
What to Say When You Talk to Yourself,4.17 avg rating — 9,331 ratings
Illusions: The Adventures of a Reluctant Messiah,4.14 avg rating — 50,551 ratings
Zero Limits: The Secret Hawaiian System for Wealth, Health, Peace, and More,4.04 avg rating — 3,009 ratings
Tao Te Ching,4.31 avg rating — 90,462 ratings
The Power of Positive Energy: Powerful Thinking, Powerful Life,4.06 avg rating — 34 ratings
Letters From The Universe: The Framework of Everything and a Cosmic Guidance to Love, Life and Beyond,4.47 avg rating — 43 ratings
Just Around The Bend: Más o Menos,4.47 avg rating — 59 ratings
Siddhartha,really liked it
4.00 avg rating — 472,004 ratings
What Ukulele Players Really Want To Know,3.92 avg rating — 51 ratings
Anastasia (The Ringing Cedars, #1),3.82 avg rating — 1,538 ratings
A Leader's Gift: How to Earn the Right to Be Followed,4.23 avg rating — 48 ratings
The Happiness Animal,3.29 avg rating — 590 ratings
Happiness Bubbles: 10 Steps to a Happy Life,4.70 avg rating — 10 ratings
Being You, Changing the World,4.39 avg rating — 339 ratings
Optimal Living 360: Smart Decision Making for a Balanced Life,3.16 avg rating — 93 ratings
Flurfunk 3.0 - Ihr Erfolgsgeheimnis dauerhafter Kundenbindung: Verbesserung von Projektmanagement, Zusammenarbeit, Wissensmanagement Motivation mit Unternehmenswikis,4.78 avg rating — 9 ratings
The Millionaire Fastlane: Crack the Code to Wealth and Live Rich for a Lifetime!,4.36 avg rating — 6,159 ratings
Choose Yourself: Be Happy, Make Millions, Live the Dream,3.88 avg rating — 9,410 ratings
Meditations,4.23 avg rating — 73,160 ratings
The Honest Book of International Dating / Smart Dating Strategies for Men (Win the Heart of a Woman of Your Dreams, #1),3.80 avg rating — 10 ratings
SURPRISES: PART 2 of "Romantic Activities and Surprises: 800 Dating Ideas - An Illustrated Guide for Men" (Win the Heart of a Woman of Your Dreams, #5),4.29 avg rating — 7 ratings
Mindful Eating (Alchemy of Love Mindfulness Training, #3),4.64 avg rating — 33 ratings
Big Magic: Creative Living Beyond Fear,3.90 avg rating — 98,131 ratings
A Mindful Nation: How a Simple Practice Can Help Us Reduce Stress, Improve Performance, and Recapture the American Spirit,3.83 avg rating — 232 ratings
The Five People You Meet in Heaven,3.91 avg rating — 500,502 ratings
Dating Communication Tips for Men (Win the Heart of a Woman of Your Dreams, #2),4.08 avg rating — 12 ratings
The Art of Seduction: Keys to Mastery / A Pocket Book for a Real Man (Win the Heart of a Woman of Your Dreams, #3),4.40 avg rating — 10 ratings
The One Minute Manager,3.86 avg rating — 84,096 ratings
The Bliss Experiment: 28 Days to Personal Transformation,3.92 avg rating — 75 ratings
Conscious Creativity; Mindfulness Meditations (Alchemy of Love Mindfulness Training Book #7),4.35 avg rating — 17 ratings
The Charge: Activating the 10 Human Drives That Make You Feel Alive,4.08 avg rating — 1,418 ratings
Ways to Propose: Part 3 of "Romantic Activities and Surprises: 800 Dating Ideas - An Illustrated Guide for Men" (Win the Heart of a Woman of Your Dreams, #6),4.29 avg rating — 17 ratings
The Power Of Less: The Fine Art of Limiting Yourself to the Essential,3.77 avg rating — 6,626 ratings
Why God Why?: What To Do When Life Doesn't Make Sense,3.73 avg rating — 22 ratings
Am I Being Kind: How Asking One Simple Question Can Change Your Life...and Your World,3.97 avg rating — 128 ratings
Creative Visualization: Use the Power of Your Imagination to Create What You Want in Your Life,4.14 avg rating — 20,033 ratings
Living in the Light: A Guide to Personal and Planetary Transformation,4.19 avg rating — 3,352 ratings
Many Lives, Many Masters: The True Story of a Prominent Psychiatrist, His Young Patient, and the Past Life Therapy That Changed Both Their Lives,4.16 avg rating — 28,924 ratings
The Rainbow Bridge: Bridge to Inner Peace and to World Peace,4.20 avg rating — 55 ratings
The Cosmic Ordering Wish Book 2010,3.92 avg rating — 13 ratings
The Seven Spiritual Laws of Success: A Practical Guide to the Fulfillment of Your Dreams,4.09 avg rating — 46,748 ratings
Jonathan Livingston Seagull,3.81 avg rating — 166,112 ratings
The Astonishing Power of Emotions: Let Your Feelings Be Your Guide,4.35 avg rating — 3,382 ratings
All By My Selves: Walter, Peanut, Achmed, and Me,really liked it
4.00 avg rating — 977 ratings
All Creatures Great and Small (All Creatures Great and Small, #1),4.32 avg rating — 102,855 ratings
Trump: The Art of the Deal,3.66 avg rating — 12,539 ratings
How to Make the Right Decision Every Time: 10 Keys for Finding God's Direction,4.14 avg rating — 14 ratings
Just Stop Having Problems Stupid,3.65 avg rating — 60 ratings
10 Steps to Self-Esteem,4.15 avg rating — 27 ratings
Igniting Your Life: Pathways to the Zenith of Health and Success,4.62 avg rating — 13 ratings
Reimagined: How amazing people design lives they love,4.15 avg rating — 34 ratings
In the Sphere of Silence,4.29 avg rating — 347 ratings
Make Your Life Worthwhile,4.48 avg rating — 108 ratings
Voyager: The Art of Pure Awareness,3.67 avg rating — 54 ratings
My Alien Self: My Journey Back to Me,3.86 avg rating — 136 ratings
A Philosopher's Notes: On Optimal Living, Creating an Authentically Awesome Life and Other Such Goodness, Vol. 1,4.15 avg rating — 371 ratings
Declutter Now!: Uncovering the Hidden Joy and Freedom in Your Life,4.30 avg rating — 44 ratings
Happy Hour is 9 to 5,3.91 avg rating — 141 ratings
Edgy Conversations: How Ordinary People Can Achieve Outrageous Success,3.96 avg rating — 795 ratings
Bioplasticity: Hypnosis Mind Body Healing,4.20 avg rating — 20 ratings
99 Inspiring Stories for Presentations: Instantly Improve Your Business Storytelling, Public Speaking and Conversation Skills,3.72 avg rating — 76 ratings
Steve Jobs: The Unauthorized Autobiography,4.36 avg rating — 126 ratings
One Woman Three Men: Redefining Modern Love and Sex: A Novel,4.75 avg rating — 4 ratings
beast mode,it was amazing
5.00 avg rating — 3 ratings
To the Survivors: One Man's Journey as a Rape Crisis Counselor with True Stories of Sexual Violence,4.11 avg rating — 82 ratings
The Slight Edge,4.40 avg rating — 12,966 ratings
Shots Of Light,really liked it
4.00 avg rating — 5 ratings
Daydreams at Work: Wake Up Your Creative Powers,4.22 avg rating — 9 ratings
Simple Meditation: A Spiritual Connection for Transforming Your Life,4.33 avg rating — 3 ratings
25 Ways to Win with People: How to Make Others Feel Like a Million Bucks,4.11 avg rating — 1,581 ratings
How to Find A Job: When There Are No Jobs A Necessary Job Search and Career Planning Guide for Today's Job Market (Find A Job Series),3.60 avg rating — 220 ratings
The Art of Doing: How Superachievers Do What They Do and How They Do It So Well,3.40 avg rating — 449 ratings
The Masculine Mind: Alpha Male Life Lessons on Careers, Money, Relationships & Women,3.80 avg rating — 20 ratings
Quotations and Photos: Mentor Me: GA=T+E-A Formula to Fulﬁll Your Greatest Achievement (Quotes, Graphic Arts, Graphic Design, Photo Quotation Reference from the Popular Motivational Self Help Book),4.11 avg rating — 9 ratings
The first Chapter: Moving on from what's been holding you back,it was amazing
5.00 avg rating — 10 ratings
The Power of Death: A Radical Path to Personal Transformation and Spiritual Enlightenment,4.03 avg rating — 34 ratings
From Fat to Fit: Turn Yourself into a Weapon of Mass Reduction,3.67 avg rating — 12 ratings
The Garden,3.74 avg rating — 129 ratings
Romantic Activities and Surprises: 800 Dating Ideas (Win the Heart of a Woman of Your Dreams, #7),4.14 avg rating — 7 ratings
Louder Than a Whisper: Clearer Than a Bell,4.70 avg rating — 33 ratings
Brand Identity Breakthrough: How to Craft Your Company's Unique Story to Make Your Products Irresistible,3.88 avg rating — 144 ratings
Chinese Astrology for Health and Wellbeing,it was amazing
5.00 avg rating — 5 ratings
The Magician's Way: What It Really Takes to Find Your Treasure,4.13 avg rating — 223 ratings
Money and Happiness (the Scientific Way): Scientifically Proven Ways to Be Happy and Highly Effective Life Hacks for Financial Independence,4.56 avg rating — 16 ratings
Chinese Astrology for Wealth and Prosperity,it was amazing
5.00 avg rating — 5 ratings
Choose To Be Happy: A Guide to Total Happiness,3.56 avg rating — 59 ratings
Solitary Fitness,3.73 avg rating — 460 ratings
The Willpower Instinct: How Self-Control Works, Why It Matters, and What You Can Do to Get More of It,4.12 avg rating — 20,395 ratings
Better Than Before: Mastering the Habits of Our Everyday Lives,3.83 avg rating — 23,841 ratings
Habit Stacking: 127 Small Actions That Take Five Minutes or Less,3.66 avg rating — 736 ratings
Quiet: The Power of Introverts in a World That Can't Stop Talking,4.05 avg rating — 249,725 ratings
Handbook to Higher Consciousness,4.18 avg rating — 434 ratings
Adulting: How to Become a Grown-up in 468 Easy(ish) Steps,3.75 avg rating — 9,608 ratings
State of Mind 2.0: 11 Lessons of the Most Productive People on the Planet,4.61 avg rating — 18 ratings
Chinese Astrology for Beginners,it was amazing
5.00 avg rating — 30 ratings
Feed Your Brain, Lose Your Belly: Experience Dynamic Weight Loss with the Brain-Belly Connection,3.36 avg rating — 75 ratings
Good to Great: Why Some Companies Make the Leap... and Others Don't,4.06 avg rating — 97,663 ratings
Yoga and Vipassana: An Integrated Life Style,4.57 avg rating — 222 ratings
Notes From A Friend,3.95 avg rating — 1,595 ratings
Are You There Blog? It's Me, Writer,4.14 avg rating — 141 ratings
The Womanly Art of Breastfeeding,4.23 avg rating — 7,341 ratings
A Guide to Mindful Eating,4.76 avg rating — 21 ratings
God's Counterpoints (Mark Miller's One, #8),4.92 avg rating — 13 ratings
How to Stop Procrastinating,3.67 avg rating — 3 ratings
Circle of Wisdom: A Path for Life, Mind and Leadership,4.62 avg rating — 8 ratings
Feel This Book: An Essential Guide to Self-Empowerment, Spiritual Supremacy, and Sexual Satisfaction,3.12 avg rating — 537 ratings
Alphabet Advice for Adults: From the letters A to Z, introspective words come into being- creating a collection of inspirational writings,it was amazing
5.00 avg rating — 1 rating
From Failure to Success: A Treasury of 50 Inspiring Stories,4.32 avg rating — 19 ratings
Zen in the Garden: Finding Peace and Healing Through Nature,4.05 avg rating — 56 ratings
Get Him Sprung!: A Woman's Guide to Getting a Great Guy and Keeping Him Forever!,4.29 avg rating — 24 ratings
Toxic Parents: Overcoming Their Hurtful Legacy and Reclaiming Your Life,4.11 avg rating — 7,558 ratings
Dream Giver,4.24 avg rating — 5,353 ratings
99 Creative WOWs Words of Wisdom for Business,4.71 avg rating — 14 ratings
A Marvelous Net (Mark Miller's One, #13),it was amazing
5.00 avg rating — 8 ratings
Buddha's Brain: The Practical Neuroscience of Happiness, Love, and Wisdom,4.05 avg rating — 7,603 ratings
The 21 Irrefutable Laws of Leadership: Follow Them and People Will Follow You,4.13 avg rating — 35,660 ratings
Embraced By The Light,3.96 avg rating — 6,717 ratings
The Art of War,3.96 avg rating — 245,185 ratings
The Science of Getting Rich,4.18 avg rating — 25,091 ratings
The Definitive Book Of Body Language,3.98 avg rating — 18,736 ratings
A Primal Wisdom : Nature's Unification of Cooperation and Competition,it was amazing
5.00 avg rating — 8 ratings
Something Beautiful,4.45 avg rating — 1,033 ratings
The Wisdom of Walt: Leadership Lessons from the Happiest Place on Earth (Disneyland): Success Strategies for Everyone,4.14 avg rating — 168 ratings
199 Ways To Improve Your Relationships, Marriage, and Sex Life,3.50 avg rating — 16 ratings
Beyond the Wisdom of Walt: Life Lessons from the Most Magical Place on Earth,4.53 avg rating — 17 ratings
A Street Cat Named Bob: How One Man and His Cat Found Hope on the Streets,3.97 avg rating — 32,859 ratings
Overcoming Depression One Step at a Time: The New Behavioral Activation Approach to Getting Your Life Back,3.95 avg rating — 60 ratings
Vision of Beauty: The Story of Sarah Breedlove Walker,4.33 avg rating — 281 ratings
Emotion Code: How to Release Your Trapped Emotions for Abundant Health, Love and Happiness,4.15 avg rating — 1,310 ratings
Conquering Irritable Bowel Syndrome,really liked it
4.00 avg rating — 4 ratings
Living the Hero's Journey: Exploring Your Role in the Action-Adventure of a Lifetime,3.96 avg rating — 24 ratings
Making Love, Not Porn: A Romantic, Natural, and Emotional Guide to Sex in the 21st Century,3.12 avg rating — 8 ratings
The Power of Your Subconscious Mind,4.14 avg rating — 29,073 ratings
Awakening: A Daily Guide to Conscious Living,4.18 avg rating — 82 ratings
Men's Health Over 50,3.20 avg rating — 5 ratings
I Can See Clearly Now,4.22 avg rating — 2,378 ratings
Depression: The Ultimate Cure: How To Get Rid Of Depression In 30 Days or Less,4.45 avg rating — 11 ratings
Thriving with Chronic Pain,4.50 avg rating — 6 ratings
The Wish Book 2007,4.17 avg rating — 6 ratings
Save Your Marriage the Sexy Way - for both men and women,1.78 avg rating — 9 ratings
365 Ways to Stop Sabotaging Your Life,4.06 avg rating — 16 ratings
Anxiety: Panicking about Panic: A Powerful, Self-Help Guide for Those Suffering from an Anxiety or Panic Disorder,4.05 avg rating — 243 ratings
The Holographic Universe,4.17 avg rating — 7,177 ratings
Mars and Venus on a Date: A Guide for Navigating the 5 Stages of Dating to Create a Loving and Lasting Relationship,3.86 avg rating — 2,291 ratings
Losing My Virginity: How I've Survived, Had Fun, and Made a Fortune Doing Business My Way,3.96 avg rating — 41,372 ratings
Bright Spots & Landmines: The Diabetes Guide I Wish Someone Had Handed Me,4.24 avg rating — 223 ratings
Secrets of the Millionaire Mind: Mastering the Inner Game of Wealth,4.17 avg rating — 32,998 ratings
Confucius Speaks: Words to Live by,4.09 avg rating — 78 ratings
Skinny Bitch: A No-Nonsense, Tough-Love Guide for Savvy Girls Who Want to Stop Eating Crap and Start Looking Fabulous!,3.35 avg rating — 29,901 ratings
Doctor Who: Short Trips and Side Steps,3.37 avg rating — 84 ratings
Thirteen Reasons Why,3.98 avg rating — 652,559 ratings
MONEY Master the Game: 7 Simple Steps to Financial Freedom,3.95 avg rating — 9,716 ratings
Anne Frank Remembered: The Story of the Woman Who Helped to Hide the Frank Family,4.27 avg rating — 51,661 ratings
The Quick and Easy Way to Effective Speaking,4.07 avg rating — 4,421 ratings
Anything You Wish: Beyond Limits,4.28 avg rating — 18 ratings
Dale Carnegie's Lifetime Plan for Success: How to Win Friends and Influence People & How to Stop Worrying and Start Living,4.16 avg rating — 1,398 ratings
The Total Money Makeover: A Proven Plan for Financial Fitness,4.29 avg rating — 51,484 ratings
The Portable Nietzsche,4.19 avg rating — 8,275 ratings
The Attractor Factor: 5 Easy Steps for Creating Wealth (or Anything Else) from the Inside Out,3.86 avg rating — 1,306 ratings
Secrets About Men Every Woman Should Know,3.63 avg rating — 812 ratings
Chicken Soup for the Romantic Soul: Inspirational Stories about Love and Romance,3.96 avg rating — 629 ratings
Type 2 Diabetes The Owner's Manual,4.33 avg rating — 46 ratings
