Love Life for Every Married Couple: How to Fall in Love, Stay in Love, Rekindle Your Love,4.09 avg rating — 281 ratings
Express As YOU: Celebrate Your Uniqueness (Soul Expression, #1),it was amazing
5.00 avg rating — 1 rating
The 28 Day Shift To Wealth: A Daily Prosperity Plan (The Shift Series),3.89 avg rating — 9 ratings
SEO 2014: Includes How to Recover From Penguin, Panda or Manual Penalties,4.27 avg rating — 15 ratings
Career Book: The 9 Foundations of a Successful Career: A Guide Book for Reaching Success at Any Stage of Your Career (Best Business Books 8),it was amazing
5.00 avg rating — 2 ratings
Cutting Through Spiritual Materialism,4.28 avg rating — 5,799 ratings
Master Your Metabolism: The 3 Diet Secrets to Naturally Balancing Your Hormones for a Hot and Healthy Body!,3.71 avg rating — 3,782 ratings
Dumbing Us Down: The Hidden Curriculum of Compulsory Schooling,4.17 avg rating — 5,368 ratings
Instant Focus - How to Get and Stay Focused at what You're Doing Instantly!,it was amazing
5.00 avg rating — 5 ratings
Geld verdienen met Ebooks op Amazon; Vergroot de Zichtbaarheid van jouw Kindle eBook en Domineer jouw Niche!,it was amazing
5.00 avg rating — 2 ratings
How to Be Happy in Life: Easy to Use Happiness Tips, Ideas and Strategies to Be Happy,it was amazing
5.00 avg rating — 1 rating
Resilienz - gedeihen trotz widriger Umstände,3.67 avg rating — 3 ratings
This Is How: Proven Aid in Overcoming Shyness, Molestation, Fatness, Spinsterhood, Grief, Disease, Lushery, Decrepitude & More. For Young and Old Alike.,3.67 avg rating — 10,000 ratings
The First Judgement (Chronicles of Brothers, #2),4.33 avg rating — 759 ratings
Talash /تلاش,4.16 avg rating — 542 ratings
Keep Your Love On: Connection Communication And Boundaries,4.53 avg rating — 1,567 ratings
Chronic Illness and the Twelve Steps: A Practical Approach to Spiritual Resilience,4.12 avg rating — 8 ratings
The Bullied Anthology: Stories of Success,4.12 avg rating — 26 ratings
How to Think Like Leonardo da Vinci: Seven Steps to Genius Every Day,3.84 avg rating — 4,178 ratings
Tiny Beautiful Things: Advice on Love and Life from Dear Sugar,4.30 avg rating — 47,347 ratings
Meditation: Insights and Inspirations,4.77 avg rating — 121 ratings
The Way We're Working Isn't Working: The Four Forgotten Needs That Energize Great Performance,3.98 avg rating — 1,790 ratings
Om Chanting and Meditation,4.58 avg rating — 342 ratings
The Success Formula for Personal Growth: 2,000 Motivational Quotes, Winning Strategies and Advice from 500 Super Successful People,4.25 avg rating — 8 ratings
Anyone Can Get an A+: How to Beat Procrastination, Reduce Stress and Improve Your Grades,4.40 avg rating — 20 ratings
Success: Find Your Way To Success By Applying The Power Of Thought Into Action;Achieve Success by Overpowering Negativity! Increase Positive Thinking and ... with Negative Emotions, Finding Happiness),really liked it
4.00 avg rating — 3 ratings
Mental Traps: The Overthinker's Guide to a Happier Life,3.52 avg rating — 460 ratings
How to Win Friends and Influence People in the Digital Age,3.98 avg rating — 3,723 ratings
Positive thinking: Eliminate negative thinking and become optimistic. Achieve happiness & success by improving your mind-set and building confidence,4.60 avg rating — 5 ratings
Leaders Eat Last,4.13 avg rating — 15,197 ratings
My First Home,4.64 avg rating — 11 ratings
Never Give Up,4.07 avg rating — 28 ratings
Joyful Transformation: 22 Keys to Reclaiming Your Authenticity,4.33 avg rating — 6 ratings
The Art of Living: The Stoics on the Nature and Function of Philosophy,4.15 avg rating — 39 ratings
The Talent Code: Unlocking the Secret of Skill in Sports, Art, Music, Math, and Just About Everything Else,4.07 avg rating — 14,425 ratings
What Husbands Wish Their Wives Knew about Men,3.61 avg rating — 31 ratings
I Feel You: The surprising power of extreme empathy,3.18 avg rating — 44 ratings
The Happiness Trap: How to Stop Struggling and Start Living: A Guide to ACT,4.08 avg rating — 4,130 ratings
Attaining Personal Freedom: Intimate Journeys of Courage,it was amazing
5.00 avg rating — 2 ratings
Living Your Legacy Now: Inspiring Life Lessons for a Successful, Healthy and Fulfilling Life,it was amazing
5.00 avg rating — 1 rating
A Course in Real Feng Shui: Make Your Property Work for You at All Times,it was amazing
5.00 avg rating — 15 ratings
A Course in Chinese Astrology: Reveal Your Destiny, Harness Your Luck with Four Pillars,4.94 avg rating — 17 ratings
Change Your Life In Seven Days,3.70 avg rating — 901 ratings
Perfect Nothing (Mark Miller's One, #7),4.82 avg rating — 22 ratings
250 Things You Should Know About Writing,4.07 avg rating — 1,356 ratings
Feel Happy Now,4.08 avg rating — 77 ratings
The Infinity of Infinite Self,4.20 avg rating — 5 ratings
DIY SEO & Internet Marketing Guide: How To Do It Yourself Search Engine Optimization and Internet Marketing (EZ Website Promotion Book 1),really liked it
4.00 avg rating — 4 ratings
The Self Improvement Book: A Guide Book for Success and Personal Development (Best Business Books 14),4.33 avg rating — 3 ratings
The Universe in a Single Atom: The Convergence of Science and Spirituality,4.06 avg rating — 7,083 ratings
Think and Grow Rich for Women: Using Your Power to Create Success and Significance,3.84 avg rating — 245 ratings
Food Allergies: The Complete Guide to Understanding and Relieving Your Food Allergies,3.17 avg rating — 12 ratings
Instant Energy - How to Get More Energy Instantly!,4.60 avg rating — 5 ratings
The Hope Handbook for Survivors: The Seach for Personal Growth,it was amazing
5.00 avg rating — 5 ratings
Liberty of Conscience: In Defense of America's Tradition of Religious Equality,3.89 avg rating — 85 ratings
Hyperbole and a Half: Unfortunate Situations, Flawed Coping Mechanisms, Mayhem, and Other Things That Happened,4.18 avg rating — 146,597 ratings
The Centurion's Wife (Acts of Faith, #1),4.07 avg rating — 10,902 ratings
The Little Book of Coaching: Motivating People to Be Winners,3.66 avg rating — 93 ratings
Enjoy Your Life,4.19 avg rating — 12,471 ratings
Notes to Myself: My Struggle to Become a Person,4.08 avg rating — 2,808 ratings
Uncovering Happiness: Overcoming Depression with Mindfulness and Self-Compassion,4.09 avg rating — 240 ratings
Culture of Revival - A Revivalist Field Manual: Vol. 1 Perseverance with Joy,3.89 avg rating — 9 ratings
Take a Relationshit: Flush the BS Out of Your Life,3.50 avg rating — 4 ratings
Meditacija,4.43 avg rating — 14 ratings
What Now?,3.76 avg rating — 2,621 ratings
Mojo: How to Get It, How to Keep It, How to Get It Back If You Lose It,3.87 avg rating — 1,484 ratings
50!: "THE LIFE, LOVES & PSYCHE OF A MALE MID-LIFE CRISIS: Volume 1 - The Journey",4.75 avg rating — 8 ratings
The Yoga Cookbook: Vegetarian Food for Body and Mind,3.93 avg rating — 108 ratings
Novice to Expert: 6 Steps to Learn Anything, Increase Your Knowledge, and Master New Skills,3.80 avg rating — 325 ratings
Rule #1 Don't Be #2,4.10 avg rating — 79 ratings
How Love Wins: The Power of Mindful Kindness,4.29 avg rating — 7 ratings
The Philosophy of Cognitive Behavioural Therapy: Stoic Philosophy as Rational and Cognitive Psychotherapy,4.19 avg rating — 137 ratings
What Wives Wish their Husbands Knew about Sex,3.61 avg rating — 82 ratings
The Myth of Easy,it was amazing
5.00 avg rating — 1 rating
Living Your Legacy Now: Inspiring Life Lessons for a Successful, Healthy and Fulfilling Life,it was amazing
5.00 avg rating — 1 rating
the 100th human,3.85 avg rating — 39 ratings
What The Torah Teaches Us About Life / Through The Themes Of The Weekly Torah Portions (4),4.55 avg rating — 11 ratings
The Tools: Transform Your Problems into Courage, Confidence, and Creativity,3.68 avg rating — 2,389 ratings
Seo SOS: Search Engine Optimization First Aid Guide,4.58 avg rating — 12 ratings
Finding Your Own North Star,4.07 avg rating — 4,688 ratings
Leadership Academy: The Only Leadership Book You Must Read,4.67 avg rating — 3 ratings
Don't Die with Your Song Unsung,4.85 avg rating — 13 ratings
Special-Needs Kids Eat Right: Strategies to Help Kids on the Autism Spectrum Focus, Learn, and Thrive,3.64 avg rating — 47 ratings
Instant Confidence - How to Be Confident Instantly!,4.83 avg rating — 6 ratings
The Case Against Perfection: Ethics in the Age of Genetic Engineering,3.76 avg rating — 608 ratings
Love and Respect: The Love She Most Desires; The Respect He Desperately Needs,4.18 avg rating — 37,617 ratings
Eat to Live: The Revolutionary Formula for Fast and Sustained Weight Loss,4.12 avg rating — 11,845 ratings
Golden Words,4.19 avg rating — 21 ratings
Pioneers of His Presence,4.33 avg rating — 6 ratings
Change Your Questions, Change Your Life: 10 Powerful Tools for Life and Work,3.90 avg rating — 879 ratings
You Cheated (Now Fix It),it was amazing
5.00 avg rating — 1 rating
Nonviolence: The Transforming Power,4.76 avg rating — 49 ratings
No Excuses!: The Power of Self-Discipline,4.13 avg rating — 5,504 ratings
Mind Power Into the 21st Century: Techniques to Harness the Astounding Powers of Thought,4.19 avg rating — 1,578 ratings
The Art of Healthy Living: A Mind-Body Approach to Inner Balance and Natural Vitality,4.25 avg rating — 20 ratings
Philosophy As a Way of Life: Spiritual Exercises from Socrates to Foucault,4.30 avg rating — 660 ratings
The God Mind Principles,4.83 avg rating — 12 ratings
Be Happy! Be Very Happy!: Embrace a new insight into human reality, love, social evolution, science and free education. Explore novel ideas on chaos and creation. Begin a life of joy and purpose.,3.40 avg rating — 5 ratings
Becoming a Real-World Samurai,3.33 avg rating — 6 ratings
We Are Not Alone: The Writer's Guide to Social Media,4.28 avg rating — 276 ratings
1971 (Mark Miller's One, #10),it was amazing
5.00 avg rating — 7 ratings
Transitions: Making Sense of Life's Changes,4.04 avg rating — 1,646 ratings
Quit Your Job: A Practical 7 Steps-Plan To Start Your Own Business and Escape the 9 to 5 (Best Business Books Book 22),3.80 avg rating — 5 ratings
Don't Die with Vacation Time on the Books,it was amazing
5.00 avg rating — 5 ratings
Instant Communication Skills - How to Improve Communications Skills Instantly!,4.38 avg rating — 8 ratings
Enriquezca Su Personalidad,4.19 avg rating — 7,971 ratings
Inside Job 8 Secrets to Loving Your Work and Thriving,4.22 avg rating — 9 ratings
Stories Of The Prophets,4.47 avg rating — 4,628 ratings
Rees Howells: Intercessor,4.39 avg rating — 2,782 ratings
The Present: The Secret to Enjoying Your Work and Life, Now!,3.93 avg rating — 6,222 ratings
Happy Family Life. Tips for a Mindful Family Life,it was amazing
5.00 avg rating — 2 ratings
Say Yes to Success Despite Your Chronic Illness: 10 Weeks to Overcoming the Obstacles of Chronic Illness and Finally Achieving What You Want in Life,3.71 avg rating — 17 ratings
The Power of Habit: Why We Do What We Do in Life and Business,4.06 avg rating — 213,294 ratings
365 Tao: Daily Meditations,4.26 avg rating — 1,952 ratings
A Better Way to Live,4.27 avg rating — 1,208 ratings
Divorce Recovery: Advice for women, men and parents, complete guide on custody, assets, separation and more.,it was amazing
5.00 avg rating — 3 ratings
Yoga Mind and Body,4.05 avg rating — 282 ratings
If You Claim to Be a Christian,4.38 avg rating — 8 ratings
Wisdom from the Dojo and Other Tales,it was amazing
5.00 avg rating — 1 rating
The Power of Faith (Mark Miller's One #11),4.42 avg rating — 12 ratings
TOP 10 SEO TIPS,3.28 avg rating — 76 ratings
Steve Jobs Book: Things You Should Learn from Steve Jobs, The Titan of Technology (Best Business Books Book 26),3.79 avg rating — 14 ratings
The Tao of Physics: An Exploration of the Parallels between Modern Physics and Eastern Mysticism,3.97 avg rating — 14,951 ratings
The Out-of-Sync Child: Recognizing and Coping with Sensory Processing Disorder,4.18 avg rating — 4,001 ratings
Instant Memory - How to Improve Memory Instantly!,4.27 avg rating — 11 ratings
Hurry Up And Meditate: Your Starter Kit For Inner Peace And Better Health,3.71 avg rating — 530 ratings
Ethik F. Erwachsene Von Morgen,really liked it
4.00 avg rating — 1 rating
Get Off Your "but": How to End Self-Sabotage and Stand Up for Yourself,3.95 avg rating — 908 ratings
Fierce Conversations: Achieving Success at Work and in Life One Conversation at a Time,3.99 avg rating — 3,320 ratings
Paradise The Believers Real Home,really liked it
4.00 avg rating — 4 ratings
The Divine Mentor: Growing Your Faith as You Sit at the Feet of the Savior,4.30 avg rating — 634 ratings
How to Catch a Cheater in 48 Hours or Less!: Exercise Your Right to Know the Truth!,4.67 avg rating — 15 ratings
The Intent Course: Say Yes To What Moves You (The Shift Series),really liked it
4.00 avg rating — 3 ratings
The Yoga Sutras,4.41 avg rating — 6,215 ratings
Brain Rules: 12 Principles for Surviving and Thriving at Work, Home, and School,4.01 avg rating — 25,394 ratings
Acres of Diamonds,4.23 avg rating — 6,685 ratings
Prepper Items for SHTF Survival,4.20 avg rating — 10 ratings
Fifty Ways I Screwed Up My Life and How You Can Avoid This,4.50 avg rating — 2 ratings
Dating Wanda,really liked it
4.00 avg rating — 1 rating
Choices (Mark Miller's One, #12),it was amazing
5.00 avg rating — 7 ratings
The Five Dysfunctions of a Team: A Leadership Fable,4.01 avg rating — 55,680 ratings
The MBA Book: Top Business School MBA in a Book,really liked it
4.00 avg rating — 8 ratings
Lakota Woman,3.96 avg rating — 4,832 ratings
Instant Connection - How to Build Rapport with Anyone Instantly!,4.67 avg rating — 6 ratings
Buddhism for Busy People: Finding Happiness in an Uncertain World,3.86 avg rating — 1,024 ratings
Warum ich kein Christ bin,3.86 avg rating — 22 ratings
Emotional Healing After Being Cheated On,really liked it
4.00 avg rating — 9 ratings
El jarrón azul,4.14 avg rating — 6,570 ratings
The Art of Racing in the Rain,4.20 avg rating — 386,477 ratings
Golden Stories of Accepted Prayers,4.65 avg rating — 43 ratings
Best Recipes from Eastern Europe: Dainty Dishes, Delicious Drinks (Edible Excellence, #5),4.55 avg rating — 22 ratings
Switch: How to Change Things When Change Is Hard,4.03 avg rating — 33,905 ratings
Recycled Thoughts: Just how Green is Green?,4.13 avg rating — 30 ratings
The Essential Rumi,4.43 avg rating — 30,087 ratings
The Healing Power of Pain. Stories of Trauma and Recovery,it was amazing
5.00 avg rating — 3 ratings
Disruptive: 7 Keys for Working Women Experiencing Hostile Environments,it was amazing
5.00 avg rating — 1 rating
The Courage to Heal: A Guide for Women Survivors of Child Sexual Abuse,4.19 avg rating — 6,919 ratings
DIY SEO & Internet Marketing Guide,4.38 avg rating — 13 ratings
Awareness,4.34 avg rating — 4,686 ratings
Popularity: Who or What is Best Liked and Why,it was amazing
5.00 avg rating — 3 ratings
Instant Stress Relief - How to Relieve Stress Instantly!,it was amazing
5.00 avg rating — 4 ratings
Why Mindfulness is Better than Chocolate: Your guide to inner peace, enhanced focus and deep happiness,3.86 avg rating — 272 ratings
Yoga für dich und überall: 60 Unglaublich Nützliche Übungen Für Jedermann und jeden Tag,3.62 avg rating — 24 ratings
The Blood Sugar Solution: The UltraHealthy Program for Losing Weight, Preventing Disease, and Feeling Great Now!,3.81 avg rating — 2,360 ratings
Qasam Us Waqt Ki / قسم اس وقت کی,4.45 avg rating — 120 ratings
Long Distance Relationships: Online Relationships to Military Relationships, surviving love from afar,really liked it
4.00 avg rating — 7 ratings
Your Best Life Now: 7 Steps to Living at Your Full Potential,really liked it
4.00 avg rating — 11,378 ratings
Healing Naturally and Primary Reflexes - Restore energy with organic moves,it was amazing
5.00 avg rating — 4 ratings
The Hero's Journey,it was amazing
5.00 avg rating — 1 rating
The 9 Steps to Financial Freedom: Practical and Spiritual Steps So You Can Stop Worrying,3.75 avg rating — 2,674 ratings
Questions,really liked it
4.00 avg rating — 5 ratings
In Search Of Excellence: Lessons from America's Best-Run Companies,3.91 avg rating — 11,344 ratings
Do You Have a Plan?: Shut Up, Make a Plan and Do Something (Self Improvement & Habits #1),3.50 avg rating — 6 ratings
Instant Speed Reading - How to Read Faster Instantly!,4.18 avg rating — 11 ratings
Just Thinking: Thoughts on Spirituality, Loss, Love & One Day at a Time,4.28 avg rating — 18 ratings
Living with Honour: A Pagan Ethics,3.98 avg rating — 112 ratings
Eastern Body, Western Mind: Psychology and the Chakra System As a Path to the Self,4.40 avg rating — 2,645 ratings
When Life Begins,4.41 avg rating — 161 ratings
Fear Busters: 14 Ways to Kick Fear to the Curb,it was amazing
5.00 avg rating — 1 rating
Cosmos,4.36 avg rating — 94,985 ratings
See You at the Top,4.26 avg rating — 10,719 ratings
DONE! How to Stop Your Anxiety Now and Start Living Your Life,it was amazing
5.00 avg rating — 1 rating
Swayed: How to Communicate for Impact,4.06 avg rating — 16 ratings
White Man's God,it was amazing
5.00 avg rating — 6 ratings
The Journal of Best Practices: A Memoir of Marriage, Asperger Syndrome, and One Man's Quest to Be a Better Husband,3.84 avg rating — 5,631 ratings
Positioning: The Battle for Your Mind: How to Be Seen and Heard in the Overcrowded Marketplace,4.04 avg rating — 12,850 ratings
Bounce: The Myth of Talent and the Power of Practice,4.05 avg rating — 5,113 ratings
CEO School: Collective Wisdom of TOP CEOs (Best Business Books Book 7),4.75 avg rating — 4 ratings
Instant Meditation - How to Meditate Instantly!,it was amazing
5.00 avg rating — 6 ratings
From Scared to Sacred: Lessons in Learning to Dance with Life,4.11 avg rating — 19 ratings
What Got You Here Won't Get You There: How Successful People Become Even More Successful,3.95 avg rating — 18,682 ratings
A Treasury Of Kahlil Gibran,4.42 avg rating — 1,868 ratings
Seeds of Nonviolent Communication - Raising a communicative generation,4.50 avg rating — 2 ratings
Ten Stupid Things Women Do to Mess Up Their Lives,3.70 avg rating — 4,518 ratings
You Are a Million $ Baby,it was amazing
5.00 avg rating — 3 ratings
The Energy Bus: 10 Rules to Fuel Your Life, Work, and Team with Positive Energy,3.85 avg rating — 8,727 ratings
Googled: The End of the World as We Know It,3.66 avg rating — 2,852 ratings
7 Ways To Make Money Online: All the Basics of the Most Popular and Feasible Ways to Generating Revenue on the Internet,liked it
3.00 avg rating — 2 ratings
Anam Cara: A Book of Celtic Wisdom,4.31 avg rating — 5,363 ratings
The Wisdom of Yoga: A Seeker's Guide to Extraordinary Living,4.24 avg rating — 1,278 ratings
Mushaf / مصحف,4.38 avg rating — 1,165 ratings
Unlimited Power: The New Science Of Personal Achievement,4.21 avg rating — 23,084 ratings
Dying and Living in the Neighborhood: A Street-Level View of America's Healthcare Promise,really liked it
4.00 avg rating — 20 ratings
Why Men Love Bitches: From Doormat to Dreamgirl—A Woman's Guide to Holding Her Own in a Relationship,3.89 avg rating — 31,558 ratings
Higher Stakes,it was amazing
5.00 avg rating — 2 ratings
The Success Factor: Your 1 Hour Guide to Achieving Your Personal and Professional Goals,4.11 avg rating — 9 ratings
Insanely Simple: The Obsession That Drives Apple's Success,3.86 avg rating — 3,012 ratings
Management School: A Book for Smart Management Training,it was amazing
5.00 avg rating — 1 rating
The Thing You Think You Cannot Do: Thirty Truths You Need to Know Now About Fear and Courage,3.19 avg rating — 162 ratings
The China Study: The Most Comprehensive Study of Nutrition Ever Conducted and the Startling Implications for Diet, Weight Loss, and Long-term Health,4.22 avg rating — 21,217 ratings
Chakras For Beginners: The 7 Chakras Guide On How to Balance your Energy Body through Chakra Healing,3.40 avg rating — 10 ratings
Through the Eyes of a Child,it was amazing
5.00 avg rating — 2 ratings
The Greatness Guide: Powerful Secrets for Getting to World Class,4.03 avg rating — 5,275 ratings
Leading at a Higher Level: Blanchard on Leadership and Creating High Performing Organizations,3.98 avg rating — 1,201 ratings
The Write Prescription: Telling Your Story to Live With and Beyond Illness,4.50 avg rating — 6 ratings
Pour Your Heart Into It: How Starbucks Built a Company One Cup at a Time,4.03 avg rating — 6,760 ratings
Gratitude Renewed - A Journey Journal,really liked it
4.00 avg rating — 4 ratings
Influencer : The Power to Change Anything,3.99 avg rating — 10,008 ratings
Kybalion: A Study of the Hermetic Philosophy of Ancient Egypt and Greece,4.29 avg rating — 4,038 ratings
Eastern Wisdom Western Soul,4.67 avg rating — 9 ratings
Inside Steve's Brain,3.88 avg rating — 4,129 ratings
How to Develop Self-Confidence And Influence People,4.13 avg rating — 3,793 ratings
From Silk to Silicon: The Story of Globalization Through Ten Extraordinary Lives,3.86 avg rating — 439 ratings
Money Success and You a New Approach to happiness and Personal Fulfillment,4.06 avg rating — 143 ratings
Eastern Wisdom for Your Soul: 111 Meditations for Everyday Enlightenment,4.27 avg rating — 15 ratings
The Saint, the Surfer, and the CEO: A Remarkable Story about Living Your Heart's Desires,really liked it
4.00 avg rating — 2,559 ratings
The Power Of Meditation: Zen Guide To Relieving Stress And Living A Peaceful Life,4.25 avg rating — 8 ratings
Unplanned: The Dramatic True Story of a Former Planned Parenthood Leader's Eye-Opening Journey Across the Life Line,4.22 avg rating — 4,427 ratings
An Average Joe's Pursuit for Financial Freedom: Change Your Perception of Money,4.17 avg rating — 36 ratings
Get the Edge,4.30 avg rating — 369 ratings
World's Best 10 Keys to Success: More Than Just a Self Help Book.,4.50 avg rating — 4 ratings
Re-Awaken the Giant Within,4.07 avg rating — 726 ratings
Major Wager,4.43 avg rating — 7 ratings
A Stolen Life,3.90 avg rating — 85,465 ratings
Apocryphal Transerfing,4.80 avg rating — 5 ratings
Happy Chasing Happy,4.62 avg rating — 8 ratings
It's Never Too Late: Getting Older, Wiser, and Worry Free in Our Golden Years,4.67 avg rating — 3 ratings
The Marshall Plan for Novel Writing,3.77 avg rating — 380 ratings
Do the Clearing: A step-by-step guide to living a happy life and getting what you want,4.50 avg rating — 8 ratings
Chicken Soup for the Soul: The Joy of Christmas: 101 Holiday Tales of Inspiration, Love and Wonder,4.35 avg rating — 65 ratings
Give Me Back My Credit!,it was amazing
5.00 avg rating — 3 ratings
The Gene Therapy Plan: Taking Control of Your Genetic Destiny with Diet and Lifestyle,3.91 avg rating — 78 ratings
Chicken Soup for the Soul: My Very Good, Very Bad Cat: 101 Heartwarming Stories about Our Happy, Heroic Hilarious Pets,4.03 avg rating — 94 ratings
Ordering From The Cosmic Kitchen: The Essential Guide to Powerful, Nourishing Affirmation: The Essential Guide to Powerful, Nourishing Affirmations,4.22 avg rating — 36 ratings
World Poker Tour: In the Money [With Chip Tricks DVD],3.46 avg rating — 28 ratings
Chicken Soup for the Soul: Living with Alzheimer’s & Other Dementias: 101 Stories of Caregiving, Coping, and Compassion,4.51 avg rating — 99 ratings
Positively Happy: Cosmic Ways To Change Your Life,3.34 avg rating — 62 ratings
How the Fierce Handle Fear: Secrets to Succeeding in Challenging Times,4.62 avg rating — 8 ratings
Chicken Soup for the Soul: The Dog Did What?: 101 Amazing Stories of Magical Moments, Miracles and... Mayhem,4.21 avg rating — 98 ratings
Chicken Soup for the Cat Lover's Soul: Stories of Feline Affection, Mystery and Charm,4.23 avg rating — 1,433 ratings
Chicken Soup for the Cat & Dog Lover's Soul: Celebrating Pets as Family with Stories About Cats, Dogs and Other Critters,4.14 avg rating — 1,094 ratings
Chicken Soup for the Soul Cookbook: Stories and Recipes from the Heart,3.67 avg rating — 76 ratings
Lone Survivor: The Eyewitness Account of Operation Redwing and the Lost Heroes of SEAL Team 10,4.35 avg rating — 64,317 ratings
Chicken Soup for the Chocolate Lover's Soul: Indulging Our Sweetest Moments,3.95 avg rating — 87 ratings
Chicken Soup for the Child's Soul: Character-Building Stories to Read with Kids Ages 5 Through 8,3.85 avg rating — 68 ratings
Corporate Ninja - attract what you want and play the game to win!,3.64 avg rating — 14 ratings
Men Are from Mars, Women Are from Venus,3.54 avg rating — 140,955 ratings
Chicken Soup for the Breast Cancer Survivor's Soul: Stories to Inspire, Support and Heal,4.12 avg rating — 115 ratings
The Wisdom Of Crowds: Why The Many Are Smarter Than The Few And How Collective Wisdom Shapes Business, Economies, Societies And Nations,3.80 avg rating — 20,657 ratings
Chicken Soup for Every Mom's Soul: 101 New Stories of Love and Inspiration for Moms of All Ages,4.03 avg rating — 76 ratings
Cosmic Ordering Wish Book 2008,4.75 avg rating — 4 ratings
Chicken Soup for the Beach Lover's Soul: Memories Made Beside a Bonfire, on the Boardwalk and with Family and Friends,4.15 avg rating — 48 ratings
Inspire Me: Unlock Your Inner Happiness,4.80 avg rating — 10 ratings
Chicken Soup for the Soul: Just for Preteens: 101 Stories of Inspiration and Support for Tweens,4.02 avg rating — 52 ratings
Unfunded,really liked it
4.00 avg rating — 6 ratings
Chicken Soup for the Soul the Gift of Christmas: A Special Collection of Joyful Holiday Stories,4.33 avg rating — 54 ratings
