Upward Entrepreneur: How to Transform Your Start-up Business in 21 Days By Unlocking the Truth of God's Word (A Daily Entrepreneur Motivation Series),it was amazing
5.00 avg rating — 7 ratings
Remarkable Me: The Woman's Guide to Becoming Fearless and Getting Whatever You Want!,4.60 avg rating — 5 ratings
Get Hired!: 20 Steps to Your First Professional Job - from Building Your Resume to Proving You're the Person to Hire,it was amazing
5.00 avg rating — 3 ratings
Partners In Passion: A Guide to Great Sex, Emotional Intimacy and Long-term Love,4.24 avg rating — 45 ratings
The Body of Chris: A Memoir of Obsession, Addiction, and Madness,4.33 avg rating — 51 ratings
The Listening Project: Lessons of Life, Love, & Listening to God,4.47 avg rating — 15 ratings
Find Your Purpose Using Science,4.13 avg rating — 39 ratings
It's Not Harder Than Cancer: The Mindsets You Need to Survive and Thrive After Serious Illness,4.67 avg rating — 6 ratings
10 Secrets of the New Rich: How To Join The World's New Breed Of Millionaires,3.53 avg rating — 78 ratings
Transform Your Life with One Powerful Question,4.60 avg rating — 5 ratings
Productivity Tools for Business: 57 Proven Online Tools to Recapture the Hours of Your Day,4.57 avg rating — 7 ratings
The Cleaning Solution,2.67 avg rating — 3 ratings
Unclog Your Happiness; A Practical Guide to Living Blissfully,4.33 avg rating — 12 ratings
The Introvert Entrepreneur: Amplify Your Strengths and Create Success on Your Own Terms,3.72 avg rating — 335 ratings
The Ten Minute Cognitive Workout: Manage Your Mood and Change Your Life in Ten Minutes a Day,4.05 avg rating — 84 ratings
Becoming a True Champion: Achieving Athletic Excellence from the Inside Out,4.38 avg rating — 8 ratings
The Magic of Mojo: The Creative Power Behind Success,it was amazing
5.00 avg rating — 2 ratings
Zero to One: Notes on Start Ups, or How to Build the Future,4.16 avg rating — 82,708 ratings
Born Creative: Free Your Mind, Free Yourself,3.69 avg rating — 48 ratings
Rainbows and Banana Peels: Surviving Life's Knocks with Grace,it was amazing
5.00 avg rating — 3 ratings
Unleashing the Miracles of Your Mind,4.45 avg rating — 11 ratings
Rock the Boat: How to Use Conflict to Heal and Deepen Your Relationship,4.39 avg rating — 18 ratings
The Road From Space: How To Find Yourself In The 21st Century,3.25 avg rating — 4 ratings
Life in a Whirlwind of Numbers: 26 Years of OCD,really liked it
4.00 avg rating — 17 ratings
Wide Awake. Every Week. 52 Voices ~ 365 Aha! Moments (Wide Awake, #2),4.82 avg rating — 11 ratings
It Happened on Munger Street: A Spiritual Journey Into Awakening,4.50 avg rating — 4 ratings
Daily Habits: How To Win Your Day: Your Days Define Your Destiny,4.09 avg rating — 274 ratings
The State of Being Love: Steps to Raise Your Vibration for a Joy Filled Life,4.67 avg rating — 6 ratings
Why Am I?: How to Find the Meaning of Life without Religion or Materialism,3.75 avg rating — 4 ratings
Becoming a Medical Mom,4.83 avg rating — 6 ratings
How to network, even if you're as shy as I was,4.05 avg rating — 19 ratings
Bandersnatch: C.S. Lewis, J.R.R. Tolkien and the Creative Collaboration of the Inklings,4.23 avg rating — 378 ratings
Lessons from Jessica: Ultimate Caregiving (Growing Up with Jessica #2),4.50 avg rating — 6 ratings
One Million in the Bank: How to Make $1,000,000 With Your Own Business, Even If You Have No Money Or Experience,3.91 avg rating — 35 ratings
The Innovation Workout: The 10 tried-and-tested steps that will build your creativity and innovation skills,4.07 avg rating — 15 ratings
Life Purpose: How To Find Your Reason For Living,4.33 avg rating — 18 ratings
The Power of 10: A practice for engaging your voice of wisdom,4.56 avg rating — 16 ratings
Eat That Frog Not! Use hsbc Time Management Approach,0.00 avg rating — 0 ratings
Receiving Financial Blessing,really liked it
4.00 avg rating — 4 ratings
Still Standing After All the Tears: Putting Back the Pieces After All Hell Breaks Loose,4.73 avg rating — 15 ratings
Mean Girls at Work: How to Stay Professional When Things Get Personal,3.35 avg rating — 247 ratings
My Magnificent Life Planner 2016,it was amazing
5.00 avg rating — 4 ratings
Gettin' Down to the "Real" Nitty-Gritty-Life: American Dream or American Nightmare,4.67 avg rating — 3 ratings
To Hold The Sun,4.23 avg rating — 125 ratings
The 4:8 Principle: The Secret to a Joy-Filled Life,4.26 avg rating — 730 ratings
Reasons to Stay Alive,4.19 avg rating — 21,911 ratings
Life Re-Scripted: Find Your Purpose and Design Your Dream Life Before The Curtains Close,3.83 avg rating — 12 ratings
The Art of Executive Appearance: 5 Simple Ways to Look Great, Gain Confidence, and Inspire a Television Audience,4.86 avg rating — 14 ratings
From Ouch! to Ahhh...the New Mom's Guide to Sex After Baby,it was amazing
5.00 avg rating — 2 ratings
Board,4.25 avg rating — 32 ratings
Effortless Savings: A Money Management Guide To Saving Without Sacrifice,3.61 avg rating — 123 ratings
Fit for Life,3.78 avg rating — 2,124 ratings
Break Free From Corporate: Be Your Own Boss,4.50 avg rating — 2 ratings
Have A Meaningful Workday! A Proven System to Simplify Work, Improve Time Management, Reduce Stress, and Boost Your Productivity,4.29 avg rating — 7 ratings
The Conspiracy Against the Human Race,4.13 avg rating — 3,029 ratings
Am I Going to Be Okay?,4.61 avg rating — 28 ratings
Beyond Engagement: A Guide to Building Healthy and Successful Organizations,really liked it
4.00 avg rating — 2 ratings
A Flight and a Ferrari,4.12 avg rating — 8 ratings
Crying Hearts of the Loved Ones,3.33 avg rating — 3 ratings
No Fears, No Excuses: What You Need to Do to Have a Great Career,4.28 avg rating — 175 ratings
How to be an Artist: Learn to envision your personal and artistic life goals, increase your creative confidence and identify the steps needed to move yourself into a future of your own making.,4.42 avg rating — 12 ratings
Path to Peace: A Guide to Managing Life After Losing a Loved One,4.75 avg rating — 4 ratings
The Cozy Life: Rediscover the Joy of the Simple Things Through the Danish Concept of Hygge,3.56 avg rating — 1,934 ratings
Getting Over Your Ovaries: How to Make 'The Change of Life' Your Bitch,4.79 avg rating — 33 ratings
Critical Thinking: DontBeStupid.club Reveals 11 Principles for Problem Solving and Good Decision Making,3.74 avg rating — 38 ratings
How to Break Any Bad Habit,it was amazing
5.00 avg rating — 1 rating
Every Natural Fact: Five Seasons of Open-Air Parenting,4.16 avg rating — 37 ratings
The Charisma Myth: How Anyone Can Master the Art and Science of Personal Magnetism,3.95 avg rating — 8,454 ratings
Feliz Ano Velho,3.86 avg rating — 2,142 ratings
Wtf? Why the Fuss?,it was amazing
5.00 avg rating — 1 rating
The Personal Power Roadmap: The Ultimate 7 Step System to Effectively Solve Problems, Make Decisions, and Reach Your Goals,4.24 avg rating — 37 ratings
The Hungry Girl's Guide to Getting and Staying FIT,4.50 avg rating — 4 ratings
Suckered: The History of Sugar, Our Toxic Addiction, Our Power to Change,4.50 avg rating — 6 ratings
Visions To The Top: A Millionaire's Secret Formula to Productivity, Visualization, and Meditation,4.66 avg rating — 59 ratings
The Aha! Moment: The Guide to Creating a Game Changer,it was amazing
5.00 avg rating — 1 rating
STOP!: 21 Stops to Reduce Stress and Enhance Joy,3.85 avg rating — 13 ratings
Cottage Cheese Thighs,4.62 avg rating — 24 ratings
Hidden Treasures Or Why Some Succeed While Others Fail (Illustrated) And Updated With Practical Success Tools,liked it
3.00 avg rating — 2 ratings
Giving Business: Creating Maximum Impact in a Meaning-Driven World,it was amazing
5.00 avg rating — 3 ratings
You Too, Can Be Wealthy and Healthy,3.50 avg rating — 2 ratings
Full Catastrophe Living: Using the Wisdom of Your Body and Mind to Face Stress, Pain, and Illness,4.21 avg rating — 8,730 ratings
The Art of Asking; or, How I Learned to Stop Worrying and Let People Help,3.98 avg rating — 24,992 ratings
Experiencing Heaven: Three True Stories,4.05 avg rating — 22 ratings
Never Too Late To Be Great,3.97 avg rating — 104 ratings
Get yourself from Crisis to Coping: Your instant emotional toolbox,4.33 avg rating — 3 ratings
The Guidebook to your Inner Power: The Ultimate Spiritual Guide from Beginners to Masters,4.89 avg rating — 9 ratings
A Ceremony Called Life: When Your Morning Coffee Is as Sacred as Holy Water,4.14 avg rating — 28 ratings
Koheles/Ecclesiastes: A New Translation with a Commentary Anthologized from Talmudic, Midrashic, and Rabbinic Sources,really liked it
4.00 avg rating — 2 ratings
Junkyard Wisdom: Resisting the Whisper of Wealth in a World of Broken Parts,4.25 avg rating — 16 ratings
Learning to Drive into the Now:PRND,4.67 avg rating — 6 ratings
The Politics of Promotion: How High-Achieving Women Get Ahead and Stay Ahead,3.81 avg rating — 42 ratings
FearFlip: Following Fear to Find Your Freedom,3.90 avg rating — 10 ratings
The Dusk And Dawn Master: A Practical Guide to Transforming Evening and Morning Habits, Achieving Better Sleep, and Mastering Your Life,liked it
3.00 avg rating — 2 ratings
Till Tomorrow,3.71 avg rating — 14 ratings
Words Never Spoken: A Book of Spoken Word,4.64 avg rating — 11 ratings
Think from the Heart, Love from the Mind,4.40 avg rating — 15 ratings
Through the Mind's Eye: A Journey of Self-Discovery,4.15 avg rating — 55 ratings
Designer Mindset: Change your mind, Change your life,it was amazing
5.00 avg rating — 3 ratings
Bertrand Court,3.34 avg rating — 419 ratings
In Search Of My Sexy Old Self: Re-discovering sex after sixty and beyond,4.71 avg rating — 7 ratings
10 Day Green Smoothie Cleanse: Lose 15lbs with 10 Day Green smoothie diet For Weight Loss. Weight loss green smoothie recipes,green smoothies: Sip Up, Slim Down ! Lose upto 15 Lbs in 10 Days!,3.93 avg rating — 14 ratings
Underspent: How I Broke My Shopping Addiction and Buying Habit,3.38 avg rating — 29 ratings
Lucky Go Happy: Make Happiness Happen!,4.40 avg rating — 65 ratings
Full Color Life: How to Live a Creative, Balanced Life,4.67 avg rating — 9 ratings
The Consumption Cleanse - Food: Giving up 13 consumption habits in 13 weeks for a better life and a healthier planet,4.12 avg rating — 16 ratings
No Barriers: A Blind Man's Journey to Kayak the Grand Canyon,4.30 avg rating — 221 ratings
She Is Without Limits,it was amazing
5.00 avg rating — 5 ratings
Got Health-Style?,3.83 avg rating — 6 ratings
Happiness is a choice: The most important decision in life,4.43 avg rating — 14 ratings
The Perks of Being a Wallflower,4.20 avg rating — 1,059,742 ratings
Paths to Wholeness: Fifty-Two Flower Mandalas,4.55 avg rating — 11 ratings
Managing Oneself,4.13 avg rating — 6,252 ratings
Untying the Fine Knots: How to Deal with Divorce,3.86 avg rating — 7 ratings
How Two Love: Making your relationship work and last,4.80 avg rating — 5 ratings
Get Control of Sugar Now!: Great Choices For Your Healthy Future,3.70 avg rating — 30 ratings
Lessons from a CF Cornerman: 38 Lessons I Learned During My Wife's Illness And Lung Transplant,4.78 avg rating — 18 ratings
Rabbit Warrior,really liked it
4.00 avg rating — 1 rating
Stretch: Unlock the Power of Less - and Achieve More Than You Ever Imagined,3.70 avg rating — 399 ratings
The Achievers: A Personal Success Handbook,really liked it
4.00 avg rating — 2 ratings
Bullshit in Psychotherapy: From an ego to a soul driven encounter,4.75 avg rating — 4 ratings
Warrior Goddess Training: Become the Woman You Are Meant to Be,4.15 avg rating — 1,531 ratings
Empath: Life Of An Empath: How To Live A Normal Life When The World Consumes You (Energy, Intuitive, Highly sensitive, Psychic Book 1),4.17 avg rating — 6 ratings
Eat. Stop. Eat,3.91 avg rating — 703 ratings
The Secret to Success,4.20 avg rating — 1,520 ratings
"Soup Sandwich" Survival:,it was amazing
5.00 avg rating — 1 rating
Rescued Royal: Sex, Drugs, and Jesus - Walking Through Hell and Colliding with Love,4.80 avg rating — 5 ratings
Ur: You Are Who You Choose to Be,it was amazing
5.00 avg rating — 1 rating
If You're Comfortable, You're Not Growing: Finding Your Tremendous,really liked it
4.00 avg rating — 3 ratings
Single But Dating: A Field Guide to Dating in the Digital Age,4.85 avg rating — 106 ratings
Reprogram Yourself for UNSTOPPABLE Self-Confidence: Your Power Guide to Squashing Self-Doubt and Worry,it was amazing
5.00 avg rating — 2 ratings
The Culprit and The Cure: Why lifestyle is the culprit behind America's poor health,4.04 avg rating — 242 ratings
Your Invisible Toolbox: The Technological Ups and Interpersonal Downs of the Millennial Generation,4.38 avg rating — 8 ratings
Business, Balance and Bliss: How the B3 Method Can Transform Your Career and Life,4.75 avg rating — 4 ratings
Motivational Interviewing: Preparing People for Change,4.19 avg rating — 2,332 ratings
You've Got 8 Seconds: Communication Secrets for a Distracted World,3.85 avg rating — 87 ratings
Drug of Choice: The Inspiring True Story Of The One-Armed Criminal Who Mastered Love And Made Millions,4.07 avg rating — 56 ratings
Keep Calm and Go Crazy : A Guide to finding your Inner Hero,4.62 avg rating — 16 ratings
Single, Shy, and Looking for Love: A Dating Guide for the Shy and Socially Anxious,really liked it
4.00 avg rating — 23 ratings
Being Indie: A No Holds Barred, Self Publishing Guide for Indie Authors,4.64 avg rating — 33 ratings
SELF HELP Because I Don't Have A Clue How To,3.38 avg rating — 8 ratings
Shift: Creating Better Tomorrows: Winning at Work and in Life,4.14 avg rating — 28 ratings
On Being Awesome: A Unified Theory of How Not to Suck,3.30 avg rating — 60 ratings
Living a Wealthy Life: Stories of Gaining an Abundance in All Five Forms of Wealth,it was amazing
5.00 avg rating — 9 ratings
Inner Peace Outer Abundance,it was amazing
5.00 avg rating — 9 ratings
Anxiety Cure: Scientifically Proven Ways to Reduce Anxiety Symptoms,it was amazing
5.00 avg rating — 1 rating
Surfing Your Inner Sea: Essential Lessons for Lasting Serenity,4.23 avg rating — 13 ratings
Zero F*cks Given: The 21st Century Man's Guide to Deep Self-Confidence,4.15 avg rating — 13 ratings
The Coach Within: 28 Big Ideas for Engaging the Power of Your Own Wisdom, Creativity, and Choices,3.83 avg rating — 6 ratings
HOW TO BE A SUCCESSFUL SLAVE: Using LAME Methodology,it was amazing
5.00 avg rating — 4 ratings
What You Can Change and What You Can't: The Complete Guide to Successful Self-Improvement,3.89 avg rating — 964 ratings
The Forward-Looking Manager in a VUCA World,it was amazing
5.00 avg rating — 1 rating
The Front Row Factor: Transform Your Life with the Art of Moment Making,4.44 avg rating — 61 ratings
Principles: Life and Work,4.24 avg rating — 7,016 ratings
The Happy Hero,4.48 avg rating — 23 ratings
LOYAL: A Leader's Guide to Winning Customer and Employee Loyalty,4.62 avg rating — 8 ratings
Meditations on Self-Discipline and Failure: Stoic Exercise for Mental Fitness,4.29 avg rating — 51 ratings
The Right-brain Business Plan: A Creative, Visual Map for Success,3.99 avg rating — 568 ratings
Soul Food, A 90 Day Journey of Self Discovery While Building Nourishing Habits,it was amazing
5.00 avg rating — 11 ratings
The Backwards K,4.30 avg rating — 27 ratings
Sour Grapes into Wine: How to Leave a Toxic Relationship to Create a Productive Lifestyle,it was amazing
5.00 avg rating — 2 ratings
Angelical Wisdoms: Messages to nourish the soul,0.00 avg rating — 0 ratings
The Authenticity Dilemma Resolved: Unleashing Your Passion and Purpose to Live More Authentically,it was amazing
5.00 avg rating — 2 ratings
7 Powerful Questions to Discover Your Dream Life,4.60 avg rating — 10 ratings
Spaz: The True Story of My Life with Adhd,4.71 avg rating — 14 ratings
Naturally Thin: Lasting Weight Loss without Dieting,4.12 avg rating — 49 ratings
Pick Up Women: Rise of the Authentic Lover - From Your First Hi To The Point Of Undressing Her (Honest Guide To 21st Century Seduction/Pick Up Guide Without BS),liked it
3.00 avg rating — 3 ratings
The Successful Millennial: Tips for Navigating the Corporate Jungle,it was amazing
5.00 avg rating — 2 ratings
Becoming Supernatural: How Common People Are Doing the Uncommon,4.39 avg rating — 400 ratings
Where Has Grandpa Murray Gone?,it was amazing
5.00 avg rating — 1 rating
The Science of Self-Discipline: The Willpower, Mental Toughness, and Self-Control to Resist Temptation and Achieve Your Goals,4.15 avg rating — 201 ratings
The Mercury Formula: Three Steps to Self Transformation,4.71 avg rating — 17 ratings
From Heartbreak to Wholeness,4.32 avg rating — 22 ratings
Choose Wonder Over Worry: Move Beyond Fear and Doubt to Unlock Your Full Potential,3.90 avg rating — 210 ratings
The Abundance Book,3.96 avg rating — 23 ratings
The Essential Nisargadatta,4.50 avg rating — 10 ratings
So You Want to Vlog?: How to start from scratch, find your voice & share your stories,4.83 avg rating — 6 ratings
Organizing Your Home with SORT and SUCCEED: Five simple steps to stop clutter before it starts, save money and simplify your life (SORT and SUCCEED Organizing Solutions Series),4.06 avg rating — 63 ratings
Year of Yes,4.07 avg rating — 42,720 ratings
5 Minute Vacations,4.50 avg rating — 4 ratings
Seven Yoga Habbits That Can Transform Your Life: Seven Yoga Sins to Avoid,it was amazing
5.00 avg rating — 3 ratings
I'm OK - You're OK,3.72 avg rating — 14,616 ratings
Shine Little Light: Kids Edition,4.45 avg rating — 100 ratings
Rock Solid: From the Bedroom to the Boardroom,it was amazing
5.00 avg rating — 3 ratings
When Helping You Is Hurting Me: Escaping the Messiah Trap,4.36 avg rating — 39 ratings
10 Takes--Pacific Northwest Writers: Perspectives on Writing,it was amazing
5.00 avg rating — 2 ratings
Willpower Doesn't Work: Discover the Hidden Keys to Success,4.30 avg rating — 474 ratings
Change: What Really Leads to Lasting Personal Transformation,4.32 avg rating — 22 ratings
Paths of Fear: An Anthology of Overcoming Through Courage, Inspiration, and the Miracle of Love (Pebbled Lane Books Book 1),4.70 avg rating — 10 ratings
Smashing Glass & Kicking Ass: Lessons from The Meanest Woman Alive,it was amazing
5.00 avg rating — 6 ratings
Wake Up, Humans!: The Chiropractic Principle That Restores the Body’s Innate Healing Power, Transforms Lives, and Unlocks Human Purpose,it was amazing
5.00 avg rating — 6 ratings
Lerkus: A Journey to End All Suffering,it was amazing
5.00 avg rating — 1 rating
It's Not A Hard Habit To Break: How To Develop Good Habits For Success In All Areas Of Your Life,it was amazing
5.00 avg rating — 1 rating
Self-Compassion: The Proven Power of Being Kind to Yourself,4.12 avg rating — 5,850 ratings
Ashtavakra Gita: The Ultimate Solace,4.40 avg rating — 5 ratings
Success Through a Positive Mental Attitude,4.34 avg rating — 5,945 ratings
Seven practical ways to self-confidence,it was amazing
5.00 avg rating — 1 rating
Assessment of Autism Spectrum Disorder: Critical Issues in Clinical, Forensic and School Settings,it was amazing
5.00 avg rating — 1 rating
The American Dream, Revisited: Ordinary People, Extraordinary Results,it was amazing
5.00 avg rating — 2 ratings
The End of Procrastination: How to Stop Postponing and Live a Fulfilled Life,4.75 avg rating — 4 ratings
True Dummy - a fable of existence,4.92 avg rating — 136 ratings
Practicing the Power of Now: Essential Teachings, Meditations, and Exercises from the Power of Now,4.25 avg rating — 32,599 ratings
College Shortcuts: An Express Undergraduate Degree with Zero Student Loans: Reviews of The Best Colleges, Free Online Courses, College Transfers and More ... Planning and Career Counseling Series,3.43 avg rating — 7 ratings
Leaders Get Up: Fulfilling the Call of Royalty,it was amazing
5.00 avg rating — 2 ratings
A Deal with God: The Power of One,3.97 avg rating — 72 ratings
Animal Moves: How to Move Like an Animal to Get You Leaner, Fitter, Stronger and Healthier for Life,4.64 avg rating — 14 ratings
The 10 Things I Wish I Knew Before I Started Freelancing: What nobody else has told you,it was amazing
5.00 avg rating — 26 ratings
The ACTIONS: 7 Steps To Awaken A New Mindset To Achieves New Results.,it was amazing
5.00 avg rating — 1 rating
Think Like a Winner - ACT Like You Won: Unleashing Power, Purpose, and Victory in Your Life,it was amazing
5.00 avg rating — 1 rating
A Year of Living Kindly: Choices That Will Change Your Life and the World Around You,4.43 avg rating — 7 ratings
Get Out of That Pit!: Straight Talk about God's Deliverance,4.33 avg rating — 5,933 ratings
Legacy of the Heart: The Spiritual Advantage of a Painful Childhood,4.29 avg rating — 182 ratings
Broken Open: How Difficult Times Can Help Us Grow,4.17 avg rating — 4,187 ratings
The Hand of God (Mark Miller's One, #4),it was amazing
5.00 avg rating — 7 ratings
Prayers: A Communion with Our Creator,4.27 avg rating — 278 ratings
Top Life Coaching Tips: Live Each Day with More Peace, Passion, Energy and Joy,it was amazing
5.00 avg rating — 3 ratings
mBraining: Using your multiple brains to do cool stuff,4.08 avg rating — 64 ratings
Codependency for Dummies,4.26 avg rating — 192 ratings
Quest, Inc.,3.48 avg rating — 25 ratings
Manga Messiah,4.38 avg rating — 653 ratings
Appears Younger Than Stated Age,really liked it
4.00 avg rating — 8 ratings
The How of Happiness: A Scientific Approach to Getting the Life You Want,3.95 avg rating — 6,114 ratings
The Secrets of Being Happy, The Technology of Hope, Health and Harmony,4.07 avg rating — 57 ratings
How I Met the Man of My Dreams: a guide to MANifesting yours,4.27 avg rating — 22 ratings
Soul Whispers: Collective Wisdom from Soul Coaches Around the World (Soul Whispers, #1),4.30 avg rating — 10 ratings
How to Sell Your Business for the Price You Want...,4.77 avg rating — 13 ratings
Positivity the Key to Life: The Power of Thinking Positive,0.00 avg rating — 0 ratings
Too Big to Fail: The Inside Story of How Wall Street and Washington Fought to Save the Financial System from Crisis — and Themselves,4.10 avg rating — 30,602 ratings
SIMPLY INFILTRATING THOUGHT "You Will Only Understand Self Ability Via A Self Push" "Holistic Combination Discovery",it was amazing
5.00 avg rating — 2 ratings
A Complaint Free World: How to Stop Complaining and Start Enjoying the Life You Always Wanted,3.93 avg rating — 2,034 ratings
50 Things To Know To Stick With A Workout: Motivational Tips To Start The New You Today (50 Things to Know Healthy Living Series Book 4),4.17 avg rating — 6 ratings
Strengths Finder 2.0,3.93 avg rating — 39,028 ratings
ACT Made Simple: An Easy-To-Read Primer on Acceptance and Commitment Therapy,4.32 avg rating — 555 ratings
A Women's Tool for Self-Empowerment: Encouraging Yourself,4.80 avg rating — 5 ratings
Reflections of Mamie - A Story of Survival,4.46 avg rating — 83 ratings
Get Things Done and Feel Great: 115 Holistic Ways to Increase Productivity and Boost Your Energy,4.50 avg rating — 2 ratings
Nothing Is Impossible: 7 Steps to Realize Your True Power and Maximize Your Results,4.12 avg rating — 69 ratings
Overcome Your Fear of Homeschooling with Insider Information,4.11 avg rating — 28 ratings
Matrix Model Management System: Guide to Cross Cultural Wisdom,it was amazing
5.00 avg rating — 1 rating
The Seven Principles for Making Marriage Work: A Practical Guide from the Country's Foremost Relationship Expert,4.20 avg rating — 12,214 ratings
Soul Self: How to Tame Your Mind, Uncover Your Blueprint & Live Your Soul Purpose (Soul Self Living, #1),3.53 avg rating — 17 ratings
Extraordinary You: A Woman's Guide to Having it All,really liked it
4.00 avg rating — 13 ratings
How to do everything and be happy,3.83 avg rating — 265 ratings
The Book of Good Practices Vol. III: How to Empower Yourself and Influence Others,4.67 avg rating — 6 ratings
The Missing Piece,4.72 avg rating — 18 ratings
The Power of Labels: How Do We Get Labeled? How Do Labels Predetermine Our Lives? How to Get Rid of Them and Live a Happier Life...,4.60 avg rating — 5 ratings
What Men Really Want: An Online Dating Guide for Women,3.50 avg rating — 6 ratings
Self-Esteem: A proven program of cognitive techniques for assessing, improving and maintaining your self-esteem,3.98 avg rating — 921 ratings
Living in Grace: The Shift to Spiritual Perception,4.25 avg rating — 8 ratings
The Law of Divine Compensation: On Work, Money, and Miracles,4.22 avg rating — 2,063 ratings
My Five Stages of Grief - A Father's Journey to Recovery from Bereavement,4.89 avg rating — 9 ratings
Happy Lemons: How Laughter Breeds Success,4.47 avg rating — 19 ratings
Be the Rainbow * Bridge Heaven and Earth: How-To Manual for Integrating Alternative and Evidence-Based Medicine,it was amazing
5.00 avg rating — 5 ratings
MAN-ERISMS: Being a Success in a Masculine World,4.27 avg rating — 11 ratings
Boundaries: When to Say Yes, How to Say No, to Take Control of Your Life,4.19 avg rating — 38,045 ratings
The Unlikely Entrepreneur,it was amazing
5.00 avg rating — 1 rating
The Human Body,0.00 avg rating — 0 ratings
Finding the S Spot Career Pleasure Secrets for Merging Skills,it was amazing
5.00 avg rating — 2 ratings
Problem Solver: An Amazing Way to Deal with Problems and Personal Challenges (Best Business Books Book 10),4.50 avg rating — 2 ratings
The Leader Code: Crack this once hidden code to become an effective leader!,4.71 avg rating — 7 ratings
The Bonobo Way,4.38 avg rating — 37 ratings
Getting to Yes with Yourself:,3.90 avg rating — 679 ratings
